{
  "schema_version": "1.0",
  "receipt_id": "88888888-8888-4888-8888-888888888888",
  "created_at": "2026-08-16T08:00:00Z",
  "actor": "synthetic-user",
  "source_version": "0.1.0",
  "target_root": ".",
  "harnesses": ["codex"],
  "operations": [{"action": "copy", "source_digest": "aaaaaaaaaaaaaaaaaaaaaaaaaaaaaaaaaaaaaaaaaaaaaaaaaaaaaaaaaaaaaaaa", "destination": ".agents/skills/the-loop/SKILL.md", "pre_existing_digest": null, "resulting_digest": "bbbbbbbbbbbbbbbbbbbbbbbbbbbbbbbbbbbbbbbbbbbbbbbbbbbbbbbbbbbbbbbb", "rollback_action": "remove_if_unchanged"}],
  "result": "complete"
}
